{
  "version": "1.4",
  "snap": {
    "step_m": 5,
    "tie_break": "toward_west"
  },
  "defaults": {
    "minor_road_length_m": 50,
    "ped_crossing_width_m": 3.5,
    "sidewalk_width_m": 2.0,
    "speed_kmh": 50
  },
  "main_road": {
    "length_m": 300,
    "center_gap_m": 6.0,
    "lanes": 2
  },
  "signal_profiles": {
    "tee": [
      {
        "id": "T_signal_A",
        "cycle_s": 90,
        "ped_early_cutoff_s": 6,
        "yellow_duration_s": 3,
        "phases": [
          {
            "duration_s": 35,
            "allow_movements": [
              "main_T",
              "pedestrian"
            ]
          },
          {
            "duration_s": 2,
            "allow_movements": []
          },
          {
            "duration_s": 20,
            "allow_movements": [
              "main_R",
              "minor_L",
              "pedestrian"
            ]
          },
          {
            "duration_s": 2,
            "allow_movements": []
          },
          {
            "duration_s": 29,
            "allow_movements": [
              "main_L",
              "minor_R",
              "pedestrian"
            ]
          },
          {
            "duration_s": 2,
            "allow_movements": []
          }
        ]
      }
    ],
    "cross": [
      {
        "id": "X_signal_A",
        "cycle_s": 90,
        "ped_early_cutoff_s": 5,
        "yellow_duration_s": 3,
        "phases": [
          {
            "duration_s": 27,
            "allow_movements": [
              "main_L",
              "main_T",
              "pedestrian"
            ]
          },
          {
            "duration_s": 16,
            "allow_movements": [
              "main_R",
              "pedestrian"
            ]
          },
          {
            "duration_s": 10,
            "allow_movements": [
              "pedestrian"
            ]
          },
          {
            "duration_s": 35,
            "allow_movements": [
              "minor_L",
              "minor_T",
              "minor_R",
              "pedestrian"
            ]
          },
          {
            "duration_s": 2,
            "allow_movements": []
          }
        ]
      }
    ],
    "xwalk_midblock": []
  },
  "layout": [
    {
      "type": "cross",
      "pos_m": 75,
      "main_approach_begin_m": 45,
      "main_approach_lanes": 3,
      "minor_lanes_approach": 2,
      "minor_lanes_departure": 1,
      "median_continuous": false,
      "main_u_turn_allowed": false,
      "signalized": true,
      "main_ped_crossing_placement": {
        "west": false,
        "east": false
      },
      "refuge_island_on_main": true,
      "two_stage_tll_control": true,
      "signal": {
        "profile_id": "X_signal_A",
        "offset_s": 0
      }
    },
    {
      "type": "tee",
      "pos_m": 225,
      "branch": "north",
      "main_approach_begin_m": 45,
      "main_approach_lanes": 3,
      "minor_lanes_approach": 2,
      "minor_lanes_departure": 1,
      "median_continuous": false,
      "main_u_turn_allowed": true,
      "signalized": true,
      "main_ped_crossing_placement": {
        "west": true,
        "east": true
      },
      "refuge_island_on_main": true,
      "two_stage_tll_control": true,
      "signal": {
        "profile_id": "T_signal_A",
        "offset_s": 0
      }
    }
  ]
}
