{
  "version": "1.4",
  "snap": {
    "step_m": 5,
    "tie_break": "toward_west"
  },
  "defaults": {
    "minor_road_length_m": 100,
    "ped_crossing_width_m": 3.5,
    "sidewalk_width_m": 2.0,
    "speed_kmh": 50
  },
  "main_road": {
    "length_m": 300,
    "center_gap_m": 6.0,
    "lanes": 1
  },
  "signal_profiles": {
    "tee": [],
    "cross": [
      {
        "id": "placeholder_cross_profile_3",
        "cycle_s": 90,
        "ped_early_cutoff_s": 3,
        "yellow_duration_s": 3,
        "phases": [
          {
            "duration_s": 10,
            "allow_movements": [
              "EB_T",
              "pedestrian"
            ]
          },
          {
            "duration_s": 10,
            "allow_movements": [
              "WB_T",
              "pedestrian"
            ]
          },
          {
            "duration_s": 10,
            "allow_movements": [
              "main_T",
              "pedestrian"
            ]
          },
          {
            "duration_s": 10,
            "allow_movements": [
              "main_L",
              "pedestrian"
            ]
          },
          {
            "duration_s": 10,
            "allow_movements": [
              "main_R",
              "pedestrian"
            ]
          },
          {
            "duration_s": 10,
            "allow_movements": [
              "minor_T",
              "pedestrian"
            ]
          },
          {
            "duration_s": 10,
            "allow_movements": [
              "minor_L",
              "pedestrian"
            ]
          },
          {
            "duration_s": 10,
            "allow_movements": [
              "minor_R",
              "pedestrian"
            ]
          },
          {
            "duration_s": 10,
            "allow_movements": [
              "pedestrian"
            ]
          }
        ]
      }
    ],
    "xwalk_midblock": []
  },
  "layout": [
    {
      "type": "cross",
      "pos_m": 150,
      "main_approach_begin_m": 50,
      "main_approach_lanes": 3,
      "minor_lanes_approach": 3,
      "minor_lanes_departure": 1,
      "median_continuous": false,
      "main_u_turn_allowed": true,
      "signalized": true,
      "main_ped_crossing_placement": {
        "west": true,
        "east": true
      },
      "refuge_island_on_main": false,
      "signal": {
        "profile_id": "placeholder_cross_profile_3",
        "offset_s": 0
      }
    }
  ]
}
